[
  {
    "schemaVersion": "kaoyan-existing-phrase-1.0",
    "source": "rebuilt",
    "articleKey": "ky-en1-2011-r-t1",
    "surface": "the talk of the world",
    "location": "P1-S1",
    "contextMeaning": "世界热议的焦点/街谈巷议的话题",
    "rawFields": {
      "contextSentence": "has been the talk of the classical-music world"
    },
    "provenance": {
      "sourceLayer": "rebuilt",
      "sourceFile": "rebuilt_data/single_texts/text_2011_t1.json",
      "year": 2011,
      "articleKey": "ky-en1-2011-r-t1",
      "extractedAt": "2026-09-18T23:13:00+0800",
      "contentHash": "sha256:df052a1f05b1ccdb02d7a5b6086e54408c4e4f349f4db04b34f6df5c4dace128"
    }
  },
  {
    "schemaVersion": "kaoyan-existing-phrase-1.0",
    "source": "rebuilt",
    "articleKey": "ky-en1-2011-r-t1",
    "surface": "to say the least",
    "location": "P1-S2",
    "contextMeaning": "至少可以说，毫不夸张地说",
    "rawFields": {
      "contextSentence": "the response has been favorable, to say the least"
    },
    "provenance": {
      "sourceLayer": "rebuilt",
      "sourceFile": "rebuilt_data/single_texts/text_2011_t1.json",
      "year": 2011,
      "articleKey": "ky-en1-2011-r-t1",
      "extractedAt": "2026-09-18T23:13:00+0800",
      "contentHash": "sha256:df052a1f05b1ccdb02d7a5b6086e54408c4e4f349f4db04b34f6df5c4dace128"
    }
  },
  {
    "schemaVersion": "kaoyan-existing-phrase-1.0",
    "source": "rebuilt",
    "articleKey": "ky-en1-2011-r-t1",
    "surface": "come as a surprise",
    "location": "P2-S1",
    "contextMeaning": "令人感到意外震惊",
    "rawFields": {
      "contextSentence": "One of the reasons why the appointment came as such a surprise"
    },
    "provenance": {
      "sourceLayer": "rebuilt",
      "sourceFile": "rebuilt_data/single_texts/text_2011_t1.json",
      "year": 2011,
      "articleKey": "ky-en1-2011-r-t1",
      "extractedAt": "2026-09-18T23:13:00+0800",
      "contentHash": "sha256:df052a1f05b1ccdb02d7a5b6086e54408c4e4f349f4db04b34f6df5c4dace128"
    }
  },
  {
    "schemaVersion": "kaoyan-existing-phrase-1.0",
    "source": "rebuilt",
    "articleKey": "ky-en1-2011-r-t1",
    "surface": "air of",
    "location": "P2-S2",
    "contextMeaning": "……的架子，神气",
    "rawFields": {
      "contextSentence": "with no air of the formidable conductor about him"
    },
    "provenance": {
      "sourceLayer": "rebuilt",
      "sourceFile": "rebuilt_data/single_texts/text_2011_t1.json",
      "year": 2011,
      "articleKey": "ky-en1-2011-r-t1",
      "extractedAt": "2026-09-18T23:13:00+0800",
      "contentHash": "sha256:df052a1f05b1ccdb02d7a5b6086e54408c4e4f349f4db04b34f6df5c4dace128"
    }
  },
  {
    "schemaVersion": "kaoyan-existing-phrase-1.0",
    "source": "rebuilt",
    "articleKey": "ky-en1-2011-r-t1",
    "surface": "strike sb as faint praise",
    "location": "P2-S3",
    "contextMeaning": "给某人以勉强恭维/明褒实贬的印象",
    "rawFields": {
      "contextSentence": "struck at least some Times readers as faint praise"
    },
    "provenance": {
      "sourceLayer": "rebuilt",
      "sourceFile": "rebuilt_data/single_texts/text_2011_t1.json",
      "year": 2011,
      "articleKey": "ky-en1-2011-r-t1",
      "extractedAt": "2026-09-18T23:13:00+0800",
      "contentHash": "sha256:df052a1f05b1ccdb02d7a5b6086e54408c4e4f349f4db04b34f6df5c4dace128"
    }
  },
  {
    "schemaVersion": "kaoyan-existing-phrase-1.0",
    "source": "rebuilt",
    "articleKey": "ky-en1-2011-r-t1",
    "surface": "to be sure",
    "location": "P3-S2",
    "contextMeaning": "诚然，无可否认",
    "rawFields": {
      "contextSentence": "To be sure, he performs an impressive variety of interesting compositions"
    },
    "provenance": {
      "sourceLayer": "rebuilt",
      "sourceFile": "rebuilt_data/single_texts/text_2011_t1.json",
      "year": 2011,
      "articleKey": "ky-en1-2011-r-t1",
      "extractedAt": "2026-09-18T23:13:00+0800",
      "contentHash": "sha256:df052a1f05b1ccdb02d7a5b6086e54408c4e4f349f4db04b34f6df5c4dace128"
    }
  },
  {
    "schemaVersion": "kaoyan-existing-phrase-1.0",
    "source": "rebuilt",
    "articleKey": "ky-en1-2011-r-t1",
    "surface": "no substitute for",
    "location": "P4-S1",
    "contextMeaning": "绝无法替代……",
    "rawFields": {
      "contextSentence": "reply that recordings are no substitute for live performance"
    },
    "provenance": {
      "sourceLayer": "rebuilt",
      "sourceFile": "rebuilt_data/single_texts/text_2011_t1.json",
      "year": 2011,
      "articleKey": "ky-en1-2011-r-t1",
      "extractedAt": "2026-09-18T23:13:00+0800",
      "contentHash": "sha256:df052a1f05b1ccdb02d7a5b6086e54408c4e4f349f4db04b34f6df5c4dace128"
    }
  },
  {
    "schemaVersion": "kaoyan-existing-phrase-1.0",
    "source": "rebuilt",
    "articleKey": "ky-en1-2011-r-t1",
    "surface": "miss the point",
    "location": "P4-S1",
    "contextMeaning": "没有抓住核心要点/不得要领",
    "rawFields": {
      "contextSentence": "are missing the point"
    },
    "provenance": {
      "sourceLayer": "rebuilt",
      "sourceFile": "rebuilt_data/single_texts/text_2011_t1.json",
      "year": 2011,
      "articleKey": "ky-en1-2011-r-t1",
      "extractedAt": "2026-09-18T23:13:00+0800",
      "contentHash": "sha256:df052a1f05b1ccdb02d7a5b6086e54408c4e4f349f4db04b34f6df5c4dace128"
    }
  },
  {
    "schemaVersion": "kaoyan-existing-phrase-1.0",
    "source": "rebuilt",
    "articleKey": "ky-en1-2011-r-t1",
    "surface": "at a time and place of one's choosing",
    "location": "P4-S3",
    "contextMeaning": "在某人自主选择的时间和地点",
    "rawFields": {
      "contextSentence": "can be consumed at a time and place of the listener's choosing"
    },
    "provenance": {
      "sourceLayer": "rebuilt",
      "sourceFile": "rebuilt_data/single_texts/text_2011_t1.json",
      "year": 2011,
      "articleKey": "ky-en1-2011-r-t1",
      "extractedAt": "2026-09-18T23:13:00+0800",
      "contentHash": "sha256:df052a1f05b1ccdb02d7a5b6086e54408c4e4f349f4db04b34f6df5c4dace128"
    }
  },
  {
    "schemaVersion": "kaoyan-existing-phrase-1.0",
    "source": "rebuilt",
    "articleKey": "ky-en1-2011-r-t1",
    "surface": "bring about a crisis in",
    "location": "P4-S4",
    "contextMeaning": "给……带来严重危机",
    "rawFields": {
      "contextSentence": "has thus brought about a crisis in the institution of the traditional classical concert"
    },
    "provenance": {
      "sourceLayer": "rebuilt",
      "sourceFile": "rebuilt_data/single_texts/text_2011_t1.json",
      "year": 2011,
      "articleKey": "ky-en1-2011-r-t1",
      "extractedAt": "2026-09-18T23:13:00+0800",
      "contentHash": "sha256:df052a1f05b1ccdb02d7a5b6086e54408c4e4f349f4db04b34f6df5c4dace128"
    }
  },
  {
    "schemaVersion": "kaoyan-existing-phrase-1.0",
    "source": "rebuilt",
    "articleKey": "ky-en1-2011-r-t1",
    "surface": "program new music",
    "location": "P5-S1",
    "contextMeaning": "把新曲目排入演出节目单",
    "rawFields": {
      "contextSentence": "for classical performers to program attractive new music"
    },
    "provenance": {
      "sourceLayer": "rebuilt",
      "sourceFile": "rebuilt_data/single_texts/text_2011_t1.json",
      "year": 2011,
      "articleKey": "ky-en1-2011-r-t1",
      "extractedAt": "2026-09-18T23:13:00+0800",
      "contentHash": "sha256:df052a1f05b1ccdb02d7a5b6086e54408c4e4f349f4db04b34f6df5c4dace128"
    }
  },
  {
    "schemaVersion": "kaoyan-existing-phrase-1.0",
    "source": "rebuilt",
    "articleKey": "ky-en1-2011-r-t1",
    "surface": "expand the repertoire",
    "location": "P5-S4",
    "contextMeaning": "扩大排演曲目库范围",
    "rawFields": {
      "contextSentence": "Merely expanding the orchestra's repertoire will not be enough"
    },
    "provenance": {
      "sourceLayer": "rebuilt",
      "sourceFile": "rebuilt_data/single_texts/text_2011_t1.json",
      "year": 2011,
      "articleKey": "ky-en1-2011-r-t1",
      "extractedAt": "2026-09-18T23:13:00+0800",
      "contentHash": "sha256:df052a1f05b1ccdb02d7a5b6086e54408c4e4f349f4db04b34f6df5c4dace128"
    }
  }
]