[
  {
    "schemaVersion": "kaoyan-existing-phrase-1.0",
    "source": "rebuilt",
    "articleKey": "ky-en1-2010-r-t2",
    "surface": "grant a patent for",
    "location": "P1-S1",
    "contextMeaning": "为……授予专利权",
    "rawFields": {
      "contextSentence": "thousands of patents have been granted for what are called business methods"
    },
    "provenance": {
      "sourceLayer": "rebuilt",
      "sourceFile": "rebuilt_data/single_texts/text_2010_t2.json",
      "year": 2010,
      "articleKey": "ky-en1-2010-r-t2",
      "extractedAt": "2026-09-18T23:13:00+0800",
      "contentHash": "sha256:747c7707bc35e6a803363f8b16649928678312155b0268290179267e90a1715f"
    }
  },
  {
    "schemaVersion": "kaoyan-existing-phrase-1.0",
    "source": "rebuilt",
    "articleKey": "ky-en1-2010-r-t2",
    "surface": "scale back on",
    "location": "P2-S1",
    "contextMeaning": "相应缩减，压缩限制",
    "rawFields": {
      "contextSentence": "appears completely ready to scale back on business-method patents"
    },
    "provenance": {
      "sourceLayer": "rebuilt",
      "sourceFile": "rebuilt_data/single_texts/text_2010_t2.json",
      "year": 2010,
      "articleKey": "ky-en1-2010-r-t2",
      "extractedAt": "2026-09-18T23:13:00+0800",
      "contentHash": "sha256:747c7707bc35e6a803363f8b16649928678312155b0268290179267e90a1715f"
    }
  },
  {
    "schemaVersion": "kaoyan-existing-phrase-1.0",
    "source": "rebuilt",
    "articleKey": "ky-en1-2010-r-t2",
    "surface": "have sb abuzz",
    "location": "P2-S2",
    "contextMeaning": "让某人群体议论纷纷/引发震动",
    "rawFields": {
      "contextSentence": "In a move that has intellectual-property lawyers abuzz..."
    },
    "provenance": {
      "sourceLayer": "rebuilt",
      "sourceFile": "rebuilt_data/single_texts/text_2010_t2.json",
      "year": 2010,
      "articleKey": "ky-en1-2010-r-t2",
      "extractedAt": "2026-09-18T23:13:00+0800",
      "contentHash": "sha256:747c7707bc35e6a803363f8b16649928678312155b0268290179267e90a1715f"
    }
  },
  {
    "schemaVersion": "kaoyan-existing-phrase-1.0",
    "source": "rebuilt",
    "articleKey": "ky-en1-2010-r-t2",
    "surface": "have the potential to do",
    "location": "P2-S4",
    "contextMeaning": "具有……的巨大潜能与可能性",
    "rawFields": {
      "contextSentence": "has the potential to eliminate an entire class of patents"
    },
    "provenance": {
      "sourceLayer": "rebuilt",
      "sourceFile": "rebuilt_data/single_texts/text_2010_t2.json",
      "year": 2010,
      "articleKey": "ky-en1-2010-r-t2",
      "extractedAt": "2026-09-18T23:13:00+0800",
      "contentHash": "sha256:747c7707bc35e6a803363f8b16649928678312155b0268290179267e90a1715f"
    }
  },
  {
    "schemaVersion": "kaoyan-existing-phrase-1.0",
    "source": "rebuilt",
    "articleKey": "ky-en1-2010-r-t2",
    "surface": "dramatic about-face",
    "location": "P3-S1",
    "contextMeaning": "戏剧性的态度180度大逆转",
    "rawFields": {
      "contextSentence": "Curbs on business-method claims would be a dramatic about-face"
    },
    "provenance": {
      "sourceLayer": "rebuilt",
      "sourceFile": "rebuilt_data/single_texts/text_2010_t2.json",
      "year": 2010,
      "articleKey": "ky-en1-2010-r-t2",
      "extractedAt": "2026-09-18T23:13:00+0800",
      "contentHash": "sha256:747c7707bc35e6a803363f8b16649928678312155b0268290179267e90a1715f"
    }
  },
  {
    "schemaVersion": "kaoyan-existing-phrase-1.0",
    "source": "rebuilt",
    "articleKey": "ky-en1-2010-r-t2",
    "surface": "stake out exclusive rights to",
    "location": "P3-S2",
    "contextMeaning": "为……圈定独占专有权利",
    "rawFields": {
      "contextSentence": "trying to stake out exclusive rights to specific types of online transactions"
    },
    "provenance": {
      "sourceLayer": "rebuilt",
      "sourceFile": "rebuilt_data/single_texts/text_2010_t2.json",
      "year": 2010,
      "articleKey": "ky-en1-2010-r-t2",
      "extractedAt": "2026-09-18T23:13:00+0800",
      "contentHash": "sha256:747c7707bc35e6a803363f8b16649928678312155b0268290179267e90a1715f"
    }
  },
  {
    "schemaVersion": "kaoyan-existing-phrase-1.0",
    "source": "rebuilt",
    "articleKey": "ky-en1-2010-r-t2",
    "surface": "beat sb to the punch",
    "location": "P3-S3",
    "contextMeaning": "抢先一步，先发制人",
    "rawFields": {
      "contextSentence": "against rivals that might beat them to the punch"
    },
    "provenance": {
      "sourceLayer": "rebuilt",
      "sourceFile": "rebuilt_data/single_texts/text_2010_t2.json",
      "year": 2010,
      "articleKey": "ky-en1-2010-r-t2",
      "extractedAt": "2026-09-18T23:13:00+0800",
      "contentHash": "sha256:747c7707bc35e6a803363f8b16649928678312155b0268290179267e90a1715f"
    }
  },
  {
    "schemaVersion": "kaoyan-existing-phrase-1.0",
    "source": "rebuilt",
    "articleKey": "ky-en1-2010-r-t2",
    "surface": "arm oneself with",
    "location": "P3-S5",
    "contextMeaning": "以……全副武装自己",
    "rawFields": {
      "contextSentence": "Wall Street investment firms armed themselves with patents for financial products"
    },
    "provenance": {
      "sourceLayer": "rebuilt",
      "sourceFile": "rebuilt_data/single_texts/text_2010_t2.json",
      "year": 2010,
      "articleKey": "ky-en1-2010-r-t2",
      "extractedAt": "2026-09-18T23:13:00+0800",
      "contentHash": "sha256:747c7707bc35e6a803363f8b16649928678312155b0268290179267e90a1715f"
    }
  },
  {
    "schemaVersion": "kaoyan-existing-phrase-1.0",
    "source": "rebuilt",
    "articleKey": "ky-en1-2010-r-t2",
    "surface": "heard by all judges (en banc)",
    "location": "P4-S2",
    "contextMeaning": "全庭法官共同审理",
    "rawFields": {
      "contextSentence": "the case would be heard by all 12 of the court's judges, rather than a typical panel of three"
    },
    "provenance": {
      "sourceLayer": "rebuilt",
      "sourceFile": "rebuilt_data/single_texts/text_2010_t2.json",
      "year": 2010,
      "articleKey": "ky-en1-2010-r-t2",
      "extractedAt": "2026-09-18T23:13:00+0800",
      "contentHash": "sha256:747c7707bc35e6a803363f8b16649928678312155b0268290179267e90a1715f"
    }
  },
  {
    "schemaVersion": "kaoyan-existing-phrase-1.0",
    "source": "rebuilt",
    "articleKey": "ky-en1-2010-r-t2",
    "surface": "in the wake of",
    "location": "P5-S1",
    "contextMeaning": "紧随……其后",
    "rawFields": {
      "contextSentence": "comes in the wake of a series of recent decisions by the Supreme Court"
    },
    "provenance": {
      "sourceLayer": "rebuilt",
      "sourceFile": "rebuilt_data/single_texts/text_2010_t2.json",
      "year": 2010,
      "articleKey": "ky-en1-2010-r-t2",
      "extractedAt": "2026-09-18T23:13:00+0800",
      "contentHash": "sha256:747c7707bc35e6a803363f8b16649928678312155b0268290179267e90a1715f"
    }
  },
  {
    "schemaVersion": "kaoyan-existing-phrase-1.0",
    "source": "rebuilt",
    "articleKey": "ky-en1-2010-r-t2",
    "surface": "react to the anti-patent trend",
    "location": "P5-S3",
    "contextMeaning": "对反专利倾向作出反应回应",
    "rawFields": {
      "contextSentence": "reacting to the anti-patent trend at the Supreme Court"
    },
    "provenance": {
      "sourceLayer": "rebuilt",
      "sourceFile": "rebuilt_data/single_texts/text_2010_t2.json",
      "year": 2010,
      "articleKey": "ky-en1-2010-r-t2",
      "extractedAt": "2026-09-18T23:13:00+0800",
      "contentHash": "sha256:747c7707bc35e6a803363f8b16649928678312155b0268290179267e90a1715f"
    }
  }
]