[
  {
    "schemaVersion": "kaoyan-existing-phrase-1.0",
    "source": "rebuilt",
    "articleKey": "ky-en1-2011-r-t4",
    "surface": "cover story",
    "location": "P1-S1",
    "contextMeaning": "杂志封面报道，封面特写",
    "rawFields": {
      "contextSentence": "Jennifer Senior's insightful, provocative magazine cover story"
    },
    "provenance": {
      "sourceLayer": "rebuilt",
      "sourceFile": "rebuilt_data/single_texts/text_2011_t4.json",
      "year": 2011,
      "articleKey": "ky-en1-2011-r-t4",
      "extractedAt": "2026-09-18T23:13:00+0800",
      "contentHash": "sha256:9f17ec01a2b95e9dba90a91ddd5cdf503bf0b2aabb3cdb0d4b3ced9aad08478a"
    }
  },
  {
    "schemaVersion": "kaoyan-existing-phrase-1.0",
    "source": "rebuilt",
    "articleKey": "ky-en1-2011-r-t4",
    "surface": "anything less than",
    "location": "P1-S1",
    "contextMeaning": "绝非，绝不仅是",
    "rawFields": {
      "contextSentence": "child rearing is anything less than a completely fulfilling, life-enriching experience"
    },
    "provenance": {
      "sourceLayer": "rebuilt",
      "sourceFile": "rebuilt_data/single_texts/text_2011_t4.json",
      "year": 2011,
      "articleKey": "ky-en1-2011-r-t4",
      "extractedAt": "2026-09-18T23:13:00+0800",
      "contentHash": "sha256:9f17ec01a2b95e9dba90a91ddd5cdf503bf0b2aabb3cdb0d4b3ced9aad08478a"
    }
  },
  {
    "schemaVersion": "kaoyan-existing-phrase-1.0",
    "source": "rebuilt",
    "articleKey": "ky-en1-2011-r-t4",
    "surface": "past-tense condition",
    "location": "P1-S2",
    "contextMeaning": "过去式状态，事后回望才得以显现的状态",
    "rawFields": {
      "contextSentence": "we should consider being happy as a past-tense condition"
    },
    "provenance": {
      "sourceLayer": "rebuilt",
      "sourceFile": "rebuilt_data/single_texts/text_2011_t4.json",
      "year": 2011,
      "articleKey": "ky-en1-2011-r-t4",
      "extractedAt": "2026-09-18T23:13:00+0800",
      "contentHash": "sha256:9f17ec01a2b95e9dba90a91ddd5cdf503bf0b2aabb3cdb0d4b3ced9aad08478a"
    }
  },
  {
    "schemaVersion": "kaoyan-existing-phrase-1.0",
    "source": "rebuilt",
    "articleKey": "ky-en1-2011-r-t4",
    "surface": "day-to-day",
    "location": "P1-S3",
    "contextMeaning": "每日琐碎的，日常的",
    "rawFields": {
      "contextSentence": "the day-to-day experience of raising kids can be soul-crushingly hard"
    },
    "provenance": {
      "sourceLayer": "rebuilt",
      "sourceFile": "rebuilt_data/single_texts/text_2011_t4.json",
      "year": 2011,
      "articleKey": "ky-en1-2011-r-t4",
      "extractedAt": "2026-09-18T23:13:00+0800",
      "contentHash": "sha256:9f17ec01a2b95e9dba90a91ddd5cdf503bf0b2aabb3cdb0d4b3ced9aad08478a"
    }
  },
  {
    "schemaVersion": "kaoyan-existing-phrase-1.0",
    "source": "rebuilt",
    "articleKey": "ky-en1-2011-r-t4",
    "surface": "Madonna-and-child",
    "location": "P2-S1",
    "contextMeaning": "圣母与圣婴图（象征慈母娇儿的经典美好画面）",
    "rawFields": {
      "contextSentence": "hardly the only Madonna-and-child image on newsstands this week"
    },
    "provenance": {
      "sourceLayer": "rebuilt",
      "sourceFile": "rebuilt_data/single_texts/text_2011_t4.json",
      "year": 2011,
      "articleKey": "ky-en1-2011-r-t4",
      "extractedAt": "2026-09-18T23:13:00+0800",
      "contentHash": "sha256:9f17ec01a2b95e9dba90a91ddd5cdf503bf0b2aabb3cdb0d4b3ced9aad08478a"
    }
  },
  {
    "schemaVersion": "kaoyan-existing-phrase-1.0",
    "source": "rebuilt",
    "articleKey": "ky-en1-2011-r-t4",
    "surface": "mom-to-be",
    "location": "P2-S3",
    "contextMeaning": "准妈妈，孕妇",
    "rawFields": {
      "contextSentence": "at least one celebrity mom, or mom-to-be, smiling on the newsstands"
    },
    "provenance": {
      "sourceLayer": "rebuilt",
      "sourceFile": "rebuilt_data/single_texts/text_2011_t4.json",
      "year": 2011,
      "articleKey": "ky-en1-2011-r-t4",
      "extractedAt": "2026-09-18T23:13:00+0800",
      "contentHash": "sha256:9f17ec01a2b95e9dba90a91ddd5cdf503bf0b2aabb3cdb0d4b3ced9aad08478a"
    }
  },
  {
    "schemaVersion": "kaoyan-existing-phrase-1.0",
    "source": "rebuilt",
    "articleKey": "ky-en1-2011-r-t4",
    "surface": "kitten-killing",
    "location": "P3-S1",
    "contextMeaning": "虐杀小猫（喻人神共愤、千夫所指的极端罪行）",
    "rawFields": {
      "contextSentence": "admitting you regret having children is equivalent to admitting you support kitten-killing"
    },
    "provenance": {
      "sourceLayer": "rebuilt",
      "sourceFile": "rebuilt_data/single_texts/text_2011_t4.json",
      "year": 2011,
      "articleKey": "ky-en1-2011-r-t4",
      "extractedAt": "2026-09-18T23:13:00+0800",
      "contentHash": "sha256:9f17ec01a2b95e9dba90a91ddd5cdf503bf0b2aabb3cdb0d4b3ced9aad08478a"
    }
  },
  {
    "schemaVersion": "kaoyan-existing-phrase-1.0",
    "source": "rebuilt",
    "articleKey": "ky-en1-2011-r-t4",
    "surface": "the childless",
    "location": "P3-S2",
    "contextMeaning": "无子女群体，丁克人群",
    "rawFields": {
      "contextSentence": "compare the regrets of parents to the regrets of the childless"
    },
    "provenance": {
      "sourceLayer": "rebuilt",
      "sourceFile": "rebuilt_data/single_texts/text_2011_t4.json",
      "year": 2011,
      "articleKey": "ky-en1-2011-r-t4",
      "extractedAt": "2026-09-18T23:13:00+0800",
      "contentHash": "sha256:9f17ec01a2b95e9dba90a91ddd5cdf503bf0b2aabb3cdb0d4b3ced9aad08478a"
    }
  },
  {
    "schemaVersion": "kaoyan-existing-phrase-1.0",
    "source": "rebuilt",
    "articleKey": "ky-en1-2011-r-t4",
    "surface": "baby-size hole",
    "location": "P3-S3",
    "contextMeaning": "婴儿大小的缺憾（指未生子女造成的人生空缺感）",
    "rawFields": {
      "contextSentence": "the gaping baby-size holes in their lives"
    },
    "provenance": {
      "sourceLayer": "rebuilt",
      "sourceFile": "rebuilt_data/single_texts/text_2011_t4.json",
      "year": 2011,
      "articleKey": "ky-en1-2011-r-t4",
      "extractedAt": "2026-09-18T23:13:00+0800",
      "contentHash": "sha256:9f17ec01a2b95e9dba90a91ddd5cdf503bf0b2aabb3cdb0d4b3ced9aad08478a"
    }
  },
  {
    "schemaVersion": "kaoyan-existing-phrase-1.0",
    "source": "rebuilt",
    "articleKey": "ky-en1-2011-r-t4",
    "surface": "lean on",
    "location": "P4-S3",
    "contextMeaning": "倚靠，仰仗",
    "rawFields": {
      "contextSentence": "to raise a kid without a partner to lean on"
    },
    "provenance": {
      "sourceLayer": "rebuilt",
      "sourceFile": "rebuilt_data/single_texts/text_2011_t4.json",
      "year": 2011,
      "articleKey": "ky-en1-2011-r-t4",
      "extractedAt": "2026-09-18T23:13:00+0800",
      "contentHash": "sha256:9f17ec01a2b95e9dba90a91ddd5cdf503bf0b2aabb3cdb0d4b3ced9aad08478a"
    }
  },
  {
    "schemaVersion": "kaoyan-existing-phrase-1.0",
    "source": "rebuilt",
    "articleKey": "ky-en1-2011-r-t4",
    "surface": "a piece of cake",
    "location": "P4-S3",
    "contextMeaning": "小菜一碟，轻而易举的事",
    "rawFields": {
      "contextSentence": "raising a kid on their \"own\" is a piece of cake"
    },
    "provenance": {
      "sourceLayer": "rebuilt",
      "sourceFile": "rebuilt_data/single_texts/text_2011_t4.json",
      "year": 2011,
      "articleKey": "ky-en1-2011-r-t4",
      "extractedAt": "2026-09-18T23:13:00+0800",
      "contentHash": "sha256:9f17ec01a2b95e9dba90a91ddd5cdf503bf0b2aabb3cdb0d4b3ced9aad08478a"
    }
  },
  {
    "schemaVersion": "kaoyan-existing-phrase-1.0",
    "source": "rebuilt",
    "articleKey": "ky-en1-2011-r-t4",
    "surface": "stress-free",
    "location": "P5-S2",
    "contextMeaning": "无忧无虑的，毫无压力的",
    "rawFields": {
      "contextSentence": "images we see every week of stress-free, happiness-enhancing parenthood"
    },
    "provenance": {
      "sourceLayer": "rebuilt",
      "sourceFile": "rebuilt_data/single_texts/text_2011_t4.json",
      "year": 2011,
      "articleKey": "ky-en1-2011-r-t4",
      "extractedAt": "2026-09-18T23:13:00+0800",
      "contentHash": "sha256:9f17ec01a2b95e9dba90a91ddd5cdf503bf0b2aabb3cdb0d4b3ced9aad08478a"
    }
  },
  {
    "schemaVersion": "kaoyan-existing-phrase-1.0",
    "source": "rebuilt",
    "articleKey": "ky-en1-2011-r-t4",
    "surface": "the Rachel",
    "location": "P5-S2",
    "contextMeaning": "“瑞秋发型”（《老友记》中风靡一时的齐肩羽毛剪发型）",
    "rawFields": {
      "contextSentence": "a small part of us hoped getting \"the Rachel\" might make us look just a little bit like Jennifer Aniston"
    },
    "provenance": {
      "sourceLayer": "rebuilt",
      "sourceFile": "rebuilt_data/single_texts/text_2011_t4.json",
      "year": 2011,
      "articleKey": "ky-en1-2011-r-t4",
      "extractedAt": "2026-09-18T23:13:00+0800",
      "contentHash": "sha256:9f17ec01a2b95e9dba90a91ddd5cdf503bf0b2aabb3cdb0d4b3ced9aad08478a"
    }
  }
]